username,comment,like,date,comment_length
Scythe6140,is there nothing called basic etiquette in CNN reporters No I mean literally you are talking to the president of the nation and such undisciplined nature of asking questions can surely invite many legal actions which could be serious How can one be so negligent about that,4,2021-11-13 10:40:59.345294,275
nasietexx,If only reporters were this persistent when asking relevant questions to the leftist and lobbyists,1,2023-09-14 10:40:59.345294,99
Yash-Gaikwad,As an outsider Whats wrong with saying that they have to come legally,3,2022-11-13 10:40:59.345294,75
Adam-bw5nz,As much we all hate to admit the reporter crossed the line,0,2020-11-13 10:40:59.345294,60
sfl6307,Does Trump remember the rude things he said about women and people who are physically challenged,2,2022-11-13 10:40:59.345294,97
bisujin1685,Just curious is that common in America Keep interrupting a person who is taking  I usually see some reporters and journalists  keep interrupting speakers,800,2020-11-13 10:40:59.345294,157
tabbytriangle3403,Imagine Biden trying to deal with reporters like that Hed be cowering behind his podium or tripping over himself to exit the stage,0,2023-11-13 10:40:59.345294,133
kenyalee4982,Temendous inner strength from a man,4,2020-11-13 10:40:59.345294,36
dudetocartman,127131 is the confident way to get someone to be quiet,2,2022-11-13 10:40:59.345294,58
AJ-rd4ng,Amazing Love him what a king,12,2020-11-13 10:40:59.345294,30
MaasHomes,I miss the days when we had a President who cared about Americans,13,2023-05-17 10:40:59.345294,66
Budtuhrdhj,These arent actors they arent from Hollywood,760,2021-11-13 10:40:59.345294,48
moneygemz5887,"Go ahead 
Points randomly anywhere just to slam the poor guy again
Lol",1,2022-11-13 10:40:59.345294,72
blackout9587,Thank you for telling me that I appreciate that,0,2023-11-13 10:40:59.345294,50
mayurraut9610,I like the way he grill reporters,0,2022-12-18 10:40:59.345294,33
matthew_dag6201,Give my man credit he stood his ground and asked his question,8,2021-11-13 10:40:59.345294,61
You000tubeuser,His roasting is always on point,0,2023-11-13 10:40:59.345294,31
meteturan1,We need engineers not drug sellers thats what Trump means,1,2019-11-14 10:40:59.345294,58
stevenneely3906,Exactly Mr President People need to go into countries the right way,0,2020-11-13 10:40:59.345294,69
mg19cal,Never understood why a president was so concerned with ratings like THAT is an important part of running the country,0,2021-11-13 10:40:59.345294,118
ericflames,I wish he made security drag him out I wouldve grabbed my popcorn,2,2023-11-13 10:40:59.345294,67
ngalahansel6066,And the way you treat other people ARE horrible POTUSs grammar lol,0,2021-11-13 10:40:59.345294,70
honewhetstone1732,"They didnt come from Hollywood

Let me run the country you run CNN",6,2022-12-18 10:40:59.345294,72
MichaelWright-qu6ou,That reporter is like that annoying kid in class that never shuts up,223,2020-11-13 10:40:59.345294,68
rahulbnair8398,I would have really appreciated had it been against  Guardian News as they always have the habit of reporting lies about India,1,2020-11-13 10:40:59.345294,130
bradical10e88,Hes not afraid of the press and their lies Thank you Mr President,1,2023-06-16 10:40:59.345294,69
notyoureverydaycultist2579,We have never seen anything like this before people,2,2022-12-18 10:40:59.345294,55
ghost_g.o.d,Thats enough  simply means give time for another to talk  Do not be greedy  I sincerely think he got what he is,0,2023-05-17 10:40:59.345294,117
bobbyray464,best stand up comedian ever,0,2022-11-13 10:40:59.345294,27
helenasmith2906,Like his policies or not I do like trumps straight forward talking And that reporter crossed the line,516,2020-11-13 10:40:59.345294,105
dylan9298,I miss Trump just for how much of a spectacle he was Maybe he wasnt the brightest guy but lord was he entertaining,1,2022-12-18 10:40:59.345294,116
musicjonk2701,Well done President Trump You are sincere and honest People have been so hard on you for trying to change things for the better,0,2020-11-13 10:40:59.345294,130
SuperAss29,Such a great and smart president I miss him and its time he comes back,0,2022-11-13 10:40:59.345294,72
SILUX1,"Just imagine this reporter asked question again and again to a dictator

After the interview the reporter is missing",5,2022-11-13 10:40:59.345294,117
standstrongwwg1wga235,I cant stand that reporter Hes a nuisance youre right hes just like one of those kids it wont quit talking when the teacher says stop talking,38,2020-11-13 10:40:59.345294,146
adachaadacha7483,We need more brave journalists like this who are not just reporting from one side of the story but from a different point of view we may be heading back in times of dictators if we choose to only have a certain group of people only heard,2,2020-11-13 10:40:59.345294,238
Mina-px3zb,His body language speaks volumes  like why does he act like he is in a movie Truly thinks the world is centered around him,2,2020-11-13 10:40:59.345294,124
onceagain6184,3 years later and this country is still being invaded ,2,2023-10-14 10:40:59.345294,55
kenburns4547,"Normally when the US President points at you and says THATS ENOUGH  people know that means to SHUT UP
At CNN they think it means go head with your question everyone wants to hear it including me",2,2020-11-13 10:40:59.345294,204
Nationalsloppy63,attacks is a excessive lol a disagreement is not an attack and he was pushing much too hard to expect a positive reaction,1,2022-12-18 10:40:59.345294,126
Patchy23,Trump attacks cnn reporter no the reporter was attacking him by the looks of it the reporter literally caused a scene,806,2020-11-13 10:40:59.345294,120
iain7418,President Trump is a truly amazing person,4,2023-08-15 10:40:59.345294,41
jennifergirling6850,That CNN reporter asks another question when Trump already said I want to hear from other reporters The CNN reporter keeps standing up  hammering Trump with questions  statements while not allowing other reporters to talk Yes that is so rude Hes not the only reporter in the room,0,2021-11-13 10:40:59.345294,286
nicholaslepore2789,i can watch this 100 times love it,32,2021-11-13 10:40:59.345294,35
Harkness197,Hes an absolute lad,2,2023-03-18 10:40:59.345294,21
rt1110,He was legit intimidated when Trump stepped out from the stand,0,2022-11-13 10:40:59.345294,62
chicatita12,I am an inmigrant and this time he is right,2,2022-12-18 10:40:59.345294,44
knoxy3514,Why doesnt the guardian title this attacks male reporter Like how they always include the word female reporter if its a female reporter,1,2020-11-13 10:40:59.345294,142
cherish9493,That reporter is no bueno  I would have trouble holding my temper in Trumps position,8,2021-11-13 10:40:59.345294,87
t-legit9066,He is one of the honest presidents In ventures to exist and tell it as its bc now everyone wants to pretend that everything is perfect and that they are okay There a lot of things that I disagree with him but I like the fact that he is speaking his mind and not afraid to hide it,2,2020-11-13 10:40:59.345294,281
vernmexico,Trump is so polite even when making these remarks he could say so much worselol,7,2021-11-13 10:40:59.345294,83
samuelsmith5400,Gosh I miss this guy,0,2022-11-13 10:40:59.345294,20
SUPERNOVA0360,Being called out by the US president,980,2020-11-13 10:40:59.345294,38
eightinches6094,If Trump goes back and watches the re runs of his press conferences like this one hell realize why the public and the media began to hate him and why he lost the election When hes cornered he cant answer the tough questions He breaks under pressure,0,2022-11-13 10:40:59.345294,258
stuartbell3652,115 the best line of his Presidency,3,2020-11-13 10:40:59.345294,36
lonestar1068,I like nothing this man stands for except his bold honesty calling out on a lying media,0,2022-11-13 10:40:59.345294,87
bettersteps,Thank you for telling me that I appreciate it  Trump is so FUNNY  I love him,7,2020-11-13 10:40:59.345294,82
ImHerobrine,"Trump attacks Reporter
Didnt think talking to someone is equivalent to attacking someone",0,2022-12-18 10:40:59.345294,91
doodbool3719,trump was actually pretty civil,30,2019-11-14 10:40:59.345294,31
GurpreetSingh-uh8vj,This is called real journalism,1,2020-11-13 10:40:59.345294,30
liberphilosophus7481,Craziness that this man tries to start a political debate with Trump at a news conference,0,2022-11-13 10:40:59.345294,90
AudriusMikalajunas,I miss him so much Not many neomammalians are left and especially leading the world forward first time after many decades,0,2023-02-16 10:40:59.345294,123
endmjwknj,Trump attacks it sounds to me like reporter keeps at it without respecting any limits and after a long time the president answers accordingly because he is a human as well,0,2022-12-18 10:40:59.345294,176
dancingverum,Instant Karma face to face An enjoyable moment when others dont respect boundaries,0,2022-12-18 10:40:59.345294,85
sea-snake8315,if you did it well your ratings would be much better,185,2019-11-14 10:40:59.345294,54
ryanhawley9501,If you watch this from the other angle you can see how he jerks the mic out of the ladies hand and obviously upsets her That is one of the main reasons trump was so mad and said what he did,0,2020-11-13 10:40:59.345294,190
themudaman9767,The reporter is speaking facts,0,2020-11-13 10:40:59.345294,30
woozy96,Girl snatched the mic like a little kid lmao,0,2023-10-14 10:40:59.345294,45
beargreen873,He mustve been so embarrassed and Im sure fired in front of the whole company Literally the President of the United States calling you out WOW,0,2022-11-13 10:40:59.345294,146
bobmiller5598,I love Mr Trump,7,2023-04-17 10:40:59.345294,15
mickaelcyr5565,Hes actually saying the truth,74,2020-11-13 10:40:59.345294,30
lilsamantha1,he is such troll love him,1,2021-11-13 10:40:59.345294,27
stephenodoom2335,Just like hon Ken agyapong outspoken Always speaking his peace of mind,1,2021-11-13 10:40:59.345294,73
user-fg5wc5rr1e,We need him back,2,2023-05-17 10:40:59.345294,16
abuabdullah9878,Thank you for telling me that I appreciate it,0,2023-09-14 10:40:59.345294,49
drgunjanchaudhary5689,You have to understand facts why he is telling you that ,0,2022-11-13 10:40:59.345294,57
lautarolencina5353,147 I loved that lady that took the mic right off that so called reporter,46,2021-11-13 10:40:59.345294,74
mattirunga2789,Im an italian guy and during the presidence I loved Trump a lothe is a rought guy he can stay close to people but he still keeps the distance from people like the reporter  Im so disappointed because of the missing of the second presidencewhat do you think,1,2021-11-13 10:40:59.345294,271
s-rankisekai2425,the title sounds sensationalised really its a huge difference between attacks CNN reporter and rebukes CNN reporter,2,2020-11-13 10:40:59.345294,121
ms.fortune2957,Firstly its rude to try and publically challenge your authority figure  This reporters first sentence was asking for trouble  NO THE REPORTER WAS RUDE  ATTACKED THE PRESIDENT  smh,2,2023-03-18 10:40:59.345294,186
geoden,"Having studied American politics for the past six or seven months now I think I can say that Trump has defiled
and damaged America in the eyes of the entire world My American friends you have my sympathy",1,2020-11-13 10:40:59.345294,207
williammasters1620,Finally a conservative who fights back against the media,160,2020-11-13 10:40:59.345294,56
ryanwohlgemuth7241,Get it Donald Youre a rockstar,1,2020-11-13 10:40:59.345294,33
bernardm.3205,I cant wait until hes thrown in jail,2,2023-07-16 10:40:59.345294,39
RxTx88,The man himself ,2,2023-06-16 10:40:59.345294,17
wackywilly6969,The real terrible people are the guardian saying trump was attacking CNN he was clearly being abused by the reporter and he was awnsering the question until the rude reporter would sit down and SHOVED the woman who wanted the mic back he should have been dragged out of the building,1,2022-11-13 10:40:59.345294,283
beatsmithx1090,Im not a trump guy but that gave me goosebumps,0,2020-11-13 10:40:59.345294,47
malsawmkhawzawl4664,There should be certain things that the public should not know the work of the government and their plans for the security of the nation ,0,2021-11-13 10:40:59.345294,138
jacktravis7179,Ya gotta love the dramatic headlines attacks reporter  Based on that  I expected him to jump down from the podium  ,1,2022-12-18 10:40:59.345294,125
kenklein9228,Thats enough I love it,4,2021-11-13 10:40:59.345294,27
beijingbrandon6220,I miss him,0,2022-11-13 10:40:59.345294,11
Z0mbify,"If that was Obama

That would be a whole different story",461,2020-11-13 10:40:59.345294,57
amyhill6619,Be blessful and Grateful dont judge the book by its cover especially when they naturally bless u,3,2020-11-13 10:40:59.345294,96
saratchandramv1886,If Trump was my grandfather i would spend alot of time with him learning the art of speech No matter how many complicated questions you face dont get fazed Come on top Command and charsima,1,2023-09-14 10:40:59.345294,195
limpu3891,you cant stop this man,1,2023-02-16 10:40:59.345294,23
normabarney5896,He didnt attack the reporter he just defended himself because after 4 years of constantly daily mistreatment he had enough of their disrespectful routine,1,2021-11-13 10:40:59.345294,156
gabriellastephanie8045,158 When the teacher needs to see a student for detention for disruptive behavior,1,2022-11-13 10:40:59.345294,83
matthewwtheman,this is the first time I ever agree with trump,149,2021-11-13 10:40:59.345294,47
madangel9691,I believe it is not necessarily what President Trump says its how he says itHe definitely should be more classy and lead by example but again those days are gone now Hes just a reflection of what society has become nobody has respect for each other regardless of titles or positions Yet everyone wants Respect and they want to be RIGHT Not everyone can be Right if thats the case then whos going to be wrong,0,2020-11-13 10:40:59.345294,417
stephanesegaert2827,"Well done Mister President 
All our support from France ",0,2021-11-13 10:40:59.345294,58
turin2,He is actually a Rude Terrible person CNN summed up in a single person Hes a Wish version of Jay Leno,3,2022-12-18 10:40:59.345294,105
truthreallyupsetsmostpeopl759,Nobody can stop him when he gets that way thats why hes GREAT,1,2023-03-18 10:40:59.345294,64
javianjohnson8746,Lol 146 Trump was about to give buddy a righthook,1,2023-10-14 10:40:59.345294,51
johnb2609,150 she took his Mic so quick,326,2021-11-13 10:40:59.345294,32
salehbayram7046,"TBH Trump is right the reporter had his turn and it was done yet he still interrupted other reporters and continued asking questions despite Trumps refusing to answer

This is not freedom of journalism thats rudness and unprofessionalism",3,2021-11-13 10:40:59.345294,239
jcrewchick,I feel like if Obama acted like this it would be a HUGE problem people would want him out of office,0,2020-11-13 10:40:59.345294,99
fimmytom854,I dont understand he did not even attack the reporter,1,2023-03-18 10:40:59.345294,55
Endorion_YTC,I always love watching this Its always a reminder how terrible of a president Biden is right now,1,2022-11-13 10:40:59.345294,99
user-py2lu9hk4d,"The way you treat people are horrible    you should be very ashamed
TRUTH TELLING    
Testifying draining EXPOSING and DISCLOSING it",0,2023-11-01 10:40:59.345294,140
MichaelWright-qu6ou,That reporter is like a child taking up all of the teachers time,177,2020-11-13 10:40:59.345294,64
ethanstube5087,Thats the man,12,2021-11-13 10:40:59.345294,15
mgmodp8966,This guy deserve the UFC BMF belt,0,2020-11-13 10:40:59.345294,34
denditaegipionedijendepowi713,You hear this man saying its  enough No more interview from him Hes banned for sure,0,2023-02-16 10:40:59.345294,87
robertl248,This is why I love Trump he has no problem with telling you how it is and that is what we need as a president,0,2020-11-13 10:40:59.345294,110
DMay-xs7mw,He did not attack him He told him his opinion He looked attacked,0,2022-11-13 10:40:59.345294,69
dreaMakerOne,Well I dont like Trump but hes totally right here,29,2021-11-13 10:40:59.345294,52
deenasharise4009,"President Trump will not let the disgusting media push him around 

LOVE IT",2,2020-11-13 10:40:59.345294,76
MsCelmusic,A real Patriot,2,2020-11-13 10:40:59.345294,14
shuddupeyaface,Leaders must be questioned,0,2022-11-13 10:40:59.345294,27
Irishgui83,Its so amazing that hes gone And now after the disastrous performance of his picks for the midterms we all know he has little chance of ever being being voted into national office again Even his own are turning on him as the right and far right always do in the end,0,2022-12-18 10:40:59.345294,271
jaymilan215,this tittle is wrong  the reporter was so disrespectful he just couldnt stop talking smh so ignorant,1,2022-11-13 10:40:59.345294,102
mohamednuur3887,I think he didnt realize that he was talking to the president,397,2019-11-14 10:40:59.345294,62
tomx6543,"You are a rude terrible person

Hold on Donnie let me get a mirror then you can say it over and over again",26,2021-11-13 10:40:59.345294,113
user-cj7dv2kc6d,That one was a classic  So funny,0,2023-08-15 10:40:59.345294,34
jesse8219,I have never seen anyone interrogate biden like this,0,2022-11-13 10:40:59.345294,52
divyeshmirajkar1222,After seeing thisI cant believe that there is just a little difference between the age of Biden and Trump,2,2021-11-13 10:40:59.345294,108
clayjulie792,I MISS this President SO MUCH,0,2022-11-13 10:40:59.345294,31
charliedallachie3539,Every other country has immigration lawswere not allowed to have ours,17,2020-11-13 10:40:59.345294,74
geetrajasthanedu,CNN should be proud of such a daring and loyal employe who dares to question for the right of people infront of everyoneand even dose not care of his job,0,2020-11-13 10:40:59.345294,158
shubhendudas2623,hope our beloved pm should also have such guts,2,2021-11-13 10:40:59.345294,46
maryhooper786,He was a strong leader,4,2023-03-18 10:40:59.345294,22
agukamubitekerezotv6055,Great content you deserve more views keep it up,0,2020-11-13 10:40:59.345294,47
willk8734,He didnt attack anyone He spoke the truth,0,2022-11-13 10:40:59.345294,43
sushmas5936,The reporter was indeed rude and disrespectful though,81,2021-11-13 10:40:59.345294,54
jw362,Trump calling someone a rude terrible person Every word out of his mouth is either a lie or a projectionevery word,1,2022-11-13 10:40:59.345294,118
randomguy-fy4nr,he calls other people rude and terrible yet he is the very same hypocrite who dont give other people a chance to speak or voice out their opinion,0,2021-11-13 10:40:59.345294,146
Anonymous-pw5kr,I really hope he doesnt run again next year Im 40 and during his time in office he somehow segregated this country almost as bad as the 60s What an embarrassment of a human being Bullied everyone that didnt agree with everything he said,0,2022-12-18 10:40:59.345294,241
scotts1356,Look at the difference between these press conferences and Bdens press conferences INCREDIBLE ABSOLUTELY INCREDIBLE,5,2021-11-13 10:40:59.345294,118
seanvandermerwe3409,A president every country needs,0,2022-12-18 10:40:59.345294,31
mutthulakshmi1730,Where did trump attack He was just stating the truth,583,2019-11-14 10:40:59.345294,53
a2zfunbegins273,When the debate is lost slander becomes the tool of the loser,0,2023-10-14 10:40:59.345294,62
joshlonon2614,Aww I love this clip Trump slaps him down at every point,2,2021-11-13 10:40:59.345294,58
bunehmwelwa6214,The reporter only wanted to irritate Donald,1,2022-11-13 10:40:59.345294,43
rajnipul3488,The funny linesyou are a rudeterrible person  That was cute,0,2020-11-13 10:40:59.345294,63
toddmathis7484,Some people just dont know when to shut up,1,2023-08-15 10:40:59.345294,44
bate1199,"Trump sit down thats enough
Reporter keeps standing up Mr Trump",25,2020-11-13 10:40:59.345294,67
newyorkersalesmanjerry2318,This is so so so so excellent  speech,0,2022-11-13 10:40:59.345294,37
piettefrank,When The con man is not facing a softball question from FOX He just melts down and isnt able to answer,2,2021-11-13 10:40:59.345294,105
universallife681,If this reporter was in India he would be in jail,2,2023-08-15 10:40:59.345294,51
Hsana41,Trump and reporters is always a deadly combination,0,2021-11-13 10:40:59.345294,50
silencz1,Reporter rudely attacks president and wont take no for an answer how about that for a headline,2,2023-05-17 10:40:59.345294,94
ArikHarv,"They werent actors You think they were actors They didnt come from Hollywood
 hilarious",32,2020-11-13 10:40:59.345294,93
hyenico,Reporters are not reporting if they keep on asking provocative questions until they get the answers they want to hear Have to agree with Trump on this even though Im not his fan,1,2021-11-13 10:40:59.345294,179
shreyas-mq4yd,Full respect to Trump for this one,2,2023-11-13 10:40:59.345294,35
rextro4799,He is just reusing the line that someone said to him,0,2022-11-13 10:40:59.345294,53
countryroadstakemehome,I love Trump Hes a realist,11,2022-11-13 10:40:59.345294,29
premsun,Can someone even dare to ask the current president in this manner Just asking ,0,2022-12-18 10:40:59.345294,81
rossnorval862,Im surprised security never flung him out,116,2021-11-13 10:40:59.345294,42
Cynthia-wz1kb,My parents were immigrants from India They came into the US legally and have been in this country for years and JUST RECENTLY got their citizenship Theyve gone through so much to get to this point Really  Build that freaking wall,1,2020-11-13 10:40:59.345294,235
g-urts5518,Trump calling someone else a rude an terrible person is just hilarious He has no leg to stand on,0,2021-11-13 10:40:59.345294,97
Noquemacuh,I miss him,0,2022-11-13 10:40:59.345294,10
duncanboyf4175,Briliant Well done don,3,2022-11-13 10:40:59.345294,24
ashively1,Well done Mr President,1,2022-11-13 10:40:59.345294,24
poopyfacetomatonose741,Trump attacks CNN reporter  Wow he really left him bloody and bruised,189,2019-11-14 10:40:59.345294,72
georgesouthwick7000,Trump calling someone rude is like a lion telling a Tiger how viscous they are,0,2022-12-18 10:40:59.345294,79
007lifestyle2,Trump is boss status  Sit down enough your done,0,2022-11-13 10:40:59.345294,50
clarkecronin5506,And there it is The nerve gets pinched  he can handle it Guess he didnt like answering questions of truth Authoritarian full blown response from the Orange Pumpkin Wow Whos the rude one,0,2022-11-13 10:40:59.345294,194
justsomecoolprayingmantisd6422,Media treats Biden like royalty compared to trump and Trump handled things a lot better   Brandon is so annoying to listen to and also Brandon gets a list of reporters names and questions beforehand Makes me sick we have a incompetent president now,0,2022-11-13 10:40:59.345294,252
Allbetter435,Rude from the start  Never lets the reporter finish then interrupts  and then lies ,0,2023-09-14 10:40:59.345294,86
doctorbad,Mistake in the video title He didnt attack a reporter he attacked Jim Acosta,60,2021-11-13 10:40:59.345294,80
lyndagiedd2104,Hes for real in America just isnt used to it anymore the Cornerstone of the foundation of a real America for those who remember,2,2021-11-13 10:40:59.345294,131
itto1282,I miss this legend,2,2022-11-13 10:40:59.345294,18
paulallen3665,Sigma rule 69 Insult the media,0,2022-11-13 10:40:59.345294,32
davidnichol6282,At least Trump has the strength of character to stand up to the press On occasions Biden just walks out in front of the media,0,2022-11-13 10:40:59.345294,127
thebeginning2595,Life hack How you feel about someone is how you reflect on your own behavior,0,2022-11-13 10:40:59.345294,78
billbertboyce324,037 I completely agree with that,23,2021-11-13 10:40:59.345294,33
sammybeck7794,When he air brushes his face with Dorito dust he always seems to miss around his eyes,8,2021-11-13 10:40:59.345294,86
kingstonperez-2484,The guy shouldnt have interrupted Trump but that attitude Trump gave him was uncalled for so I think they are both in the wrong,2,2023-06-16 10:40:59.345294,128
nikname5910,this guy is a boss now you have biden he forget his lunch 30min after eating,2,2022-11-13 10:40:59.345294,76
ericdietz2605,Man I miss him,1,2022-11-13 10:40:59.345294,14
riverday9131,At least you have a Chance to challenge or even attack your president verbally,0,2022-12-18 10:40:59.345294,79
adam-iy5oy,"nobody
trumps finger",6,2020-11-13 10:40:59.345294,23
edm8777,That mic whip was beautiful,0,2020-11-13 10:40:59.345294,27
weronikapiotrkowska6757,Well done Trump finally a President who says what he thinks,9,2020-11-13 10:40:59.345294,60
isolemayian6181,that is enough,1,2022-11-13 10:40:59.345294,16
Daniel-id6le,Loved this,0,2023-10-14 10:40:59.345294,11
wolfy9549,"Reporter Ugh Mr Pr 

Trump SIT TF DOWN",0,2022-11-13 10:40:59.345294,42
davebancos,This wouldve been 10x better if he just went off and said Oh IM the rude one,83,2021-11-13 10:40:59.345294,83
garlicbreathcomedy5670,"I did that powerpose 139 yesterday at the supermarket
Happy to say it worked at I got a refund on my unpopped popcorn",0,2022-11-13 10:40:59.345294,121
nigelsensible807,If only Jim had said  what will you do when you lose the 2020 election,1,2021-11-13 10:40:59.345294,73
TheRaptorWranglerCreates,"Its called Attacked for Trump
Its called nothing ever happened for anybody else",1,2022-12-18 10:40:59.345294,87
susiestone5644,How come Jimmy or CNN has never acted this way with Brandon,0,2022-11-13 10:40:59.345294,60
rodg2218,Do not forget the word respect at all times,75,2020-11-13 10:40:59.345294,46
benjaminchew36,"When your CNN channels are not releasing their latest news update you get frustrated 
When you get frustrated your work suffers
When your work suffers you interview the wrong man with the wrong question
When you interview the wrong man with the wrong question you gets the label of being a horrible and rude person",0,2020-11-13 10:40:59.345294,322
