username,comment,like,date,comment_length
melona3727,"He ran and aimed a weapon to the police what if he had a small gun hidden in his pocket
Police did the right thing first of all he should never take away weapon from a policeman",9,2020-11-13 10:40:59.345294,180
nobodyfromnowhere3597,The guy was resisting arrest and did prove himself rather dangerous make of it what you will but in my book it is quite justified it is not like George Floyde it is more heated moment,4,2020-11-13 10:40:59.345294,186
georged.7889,Regardless of how its edited they showed the 2 most crucial pieces of info we need to see a pat down of the suspect and the shots being fired Why shoot an unarmed person even if he was running If I were black Id flee too,0,2020-11-13 10:40:59.345294,228
JUICEeSCO,Wow they are distracting us with police work ,0,2020-11-13 10:40:59.345294,47
MrDogonjon,Dude woke up drunk in his car and out wrestled two cops just like that  Why did he fight Were the cops supposed to think he wasnt dangerous after he defeated both of them Bad choice to defend this gaper passed out in the drive through little mercy much pity,0,2020-11-13 10:40:59.345294,265
TheAndy19701970,I am not from US  but I believe Yes black life do matter BUT sometimes people just too damn stupid to get killed This one happen to be a black one I feel really sorry for that cop that in trouble now,0,2020-11-13 10:40:59.345294,202
JohnnyTran-qh3ot,Why doesnt cnn show the entire video of the police giving him a sobriety test and talking him nicely and the reason which led to his arrest Deceptive editing,23,2020-11-13 10:40:59.345294,160
seanestes2004,Ill be honest at 1st before watching the video I thought the cops were justified but knowing that they patted him down and he was found to have no weapons on him that was excessive force,10,2020-11-13 10:40:59.345294,192
lawrencegoldman1823,Why did the cop try to make him look like a fool for a half hour  He was from out of town its understandable that he didnt know exactly where he was  Cop was making a joke of him  Why did they grab him by the wrist  Tell him to put his hands behind his back and see how he reacts before you get grabby  I could tell that neither of the cops enjoy their work or even want to be on the job  Why did the first cop ask Rayshard to drive to the parking spot  Thats just dumb  Why did the cop ask him how much money he had  Thats just racist  They would not have treated a white person like that  They should have given him a ride to the hotel or called an Uber  Would he have shot a white person in the back  I dont think so,0,2020-11-13 10:40:59.345294,739
edwardcastillo3717,Isnt shooting someone in the back manslaughter Im confused the man pointed the taser at the cop and shot yes but he was running so there was no way he would of came back to the cops to grab their weapons because he was in a flight state I dont get it,0,2020-11-13 10:40:59.345294,261
Tony-md7dk,Cant wait to see this guy 8th grade graduation picture  Maybe his kindergarten teacher will come out and talk about he was such a good boy and show his finger paintings,0,2020-11-13 10:40:59.345294,171
josephclements2145,Wtf how did this guy watch this video and see a completely 180 degree reversal of what any logical person would see,0,2020-11-13 10:40:59.345294,115
Fillinyourname,The truth is that they just dont feel like running,13,2020-11-13 10:40:59.345294,51
aujax1,a taser is not lethal UNLESS the man tases you and then takes your gun while you are stunned then it becomes lethal,0,2020-11-13 10:40:59.345294,117
stollifa,Me just wonder If US police officers are now forbidden to take lifethreatening strangleholds or similar measures during arrests will that not lead them to resort to firearms Means there will be more deaths from firearm use,0,2020-11-13 10:40:59.345294,228
kopynd1,the evidence was there they didnt need to cuff him so what he runs away you ve got him later police need to come to the uk on a bad situation course he didnt need to die black men are really strong and thats what frightens the cops,1,2020-11-13 10:40:59.345294,235
professormawillett4297,This guy is being naive In the moment the cops dont actually know what he has in his hand They just had an aggressive perpetrator in a fight with two policemen He points something at them and they fire at him If they hesitated it could have been one of them,4,2020-11-13 10:40:59.345294,264
mukhbirsandhu2035,He wasnt a threat Running away Didnt need to shoot him,0,2022-11-13 10:40:59.345294,59
Omilloadams,Edited to make you think different they shouldve just let that man run it was only a DUI,15,2020-11-13 10:40:59.345294,89
kyrie6046,Why did it need two officers from behind to cuff him is that US Police protocol That was a critical mistake One officer should be in front of Mr Brooks to read his eyes and body language and talking to Mr Brooks at all times That would of reduced the chance of a fight and flight by Mr Brooks The rest that followed after that would not of happened The officers were guilty of being caught by surprise by Mr Brooks losing a scuffle losing a tazer running after Mr Brooks and then shooting him This was all so avoidable Poor police practice was evident here UK Police are taught to back away from any situation that might otherwise escalate and to not feel that they have to win every possible or probable confrontation A police officers best weapon is their mouth Where was the greater reasonableness proportionality and the greater emphasis on considering every other option by these two officers,0,2020-11-13 10:40:59.345294,917
marzabansam8093,This situation could have been avoided Mr Brooks was very cooperative He even suggested to walk home back to his family But this cop wanted more so he keep pressing him to a point where he lost his life Discharge from service is nothing He should be tried for murder justice has to he served,4,2020-11-13 10:40:59.345294,299
musictifymeg.6187,it is not about racism it is about police training  The media making it worse,0,2020-11-13 10:40:59.345294,81
networthmedia5818,Here in Kenya we are doing better We thought america was the super power its shameful In Kenya a policeman would bundle a drunk driver in the police car and drive him to the station then take his car to the nearest police station no bullets fired to an intoxicated man,1,2020-11-13 10:40:59.345294,277
stephaniedorene,He asked him twice to pull over the first time he fell back asleep so the officer went back to the car and told him again Show the whole video,0,2020-11-13 10:40:59.345294,147
jeffchurum1431,How does two officers lose  video simultaneously Coz they both did lose records Is this the new tech of getting rid of evidence,7,2020-11-13 10:40:59.345294,130
parttimepreppers9907,He went from Fairly Cooperative to Beast mode very Quickly no one should be shot it the Backyet would be interested what his toxicology results were,0,2020-11-13 10:40:59.345294,152
michaellopez5437,Erik Killmonger  The world took everything away from me Everything I ever loved But Ima make sure were even Ive waited my whole life for this The worlds going to start over IMA BURN IT ALL,0,2020-11-13 10:40:59.345294,200
jakobbennett540,Worst possible timing for this like come on That being said cop should not be arrested or fired,0,2020-11-13 10:40:59.345294,98
southernman5839,He was armed with the officer taser  and shot it at the policeman If he wouldnt have resisted  he would be in jail but not dead  What if he got away and got a gun and hunted both officers down  Theres a lot of what ifs but it could happen  Rayshard  should have had responsibility for him self not to be driving and drinking  He could have kill a lot of people just being behind the wheel,0,2020-11-13 10:40:59.345294,396
BetzBros,So why did the cop get fired What did he do wrong,0,2020-11-13 10:40:59.345294,51
TheTinfoilmanlive,Why did the cop pull off his body cam,7,2020-11-13 10:40:59.345294,38
SapoVerdeSalsa,Ah yes the room temperature challenge,0,2020-11-13 10:40:59.345294,39
jojoa-gogo5595,"Does it seem he was running away
not toward the police so they had
both the distance and the advantage
to just aim low for his legs not back",0,2020-11-13 10:40:59.345294,144
cosmeticbeauty888,He didnt have to shoot he was running away he was not a threat at any time in the video,0,2020-11-13 10:40:59.345294,91
ThanhNguyen-pm7xn,The suspect WAS ARMEDarmed with the cops taser Being shot by a taser can incapacitate the cop to the point that he would not have any control over his duty belt which is loaded with other weapons that could be used against him The driver DID fire the taser at the officer The officer returned fire So is the cop supposed to let the driver shoot him with the taser What is the threshold,0,2020-11-13 10:40:59.345294,396
kensonyavaughn8116,Clearly the cop is going to prison ,0,2020-11-13 10:40:59.345294,37
PeterSolarchannel,New normal is so much different from what i expected it to be,60,2020-11-13 10:40:59.345294,62
blowndome,How about you show the video where Brooks shoots the cops face point blank when struggling on the ground They only show him running away and shooting but not the first,0,2020-11-13 10:40:59.345294,169
mmmmkay4773,Why couldnt he just remain asleep in the parking lot until he sobered up Wasnt like he was driving 100 on the opposite side of the highway,0,2020-11-13 10:40:59.345294,142
Bola-pg5zw,Poor guy shouldnt have died but all he had to do was comply and live to dispute it later  I dont think most cops wake up in the morning  go on duty and wonder hhmmm how many people can I kill today,0,2020-11-13 10:40:59.345294,212
breathebreathe2022,Lazy they didnt want to run  they knew he was unarmed Even if you tussle its not proper to use excess to subdue a person those rights are going to change more tasers unfortunate for longer reach but firing on a person for a little bit of alcohol is abuse  Death in this case The alcohol laws are going to change now that we have let weedganjamarijuana rules change laws should and due change according to the times these laws here even officers are going to change better social economic change are going to too,0,2020-11-13 10:40:59.345294,529
nb7748,Shortened and edited that is your first clue how this is going to be biased when the commentator says that,0,2020-11-13 10:40:59.345294,107
ammonnewell1327,004 do you really have to put race into everything,10,2020-11-13 10:40:59.345294,52
richardsimpson2158,"THE IDEA THAT YOU CAN SHOOT SOMEBODY RUNNING AWAY IN THE BACK FOR GRABBING A TAZIER IS INSANE
THE COPS ARE BEHAVING LIKE SOLDIERS",1,2020-11-13 10:40:59.345294,131
cunn1n6ham,Heres a crazy thought when the cops are cuffing you dont resist and grab their taserthat said running away back turned no need to shoot at that pointbut youre asking cops to react like a robot not going to happen emotions high they were just attacked resisting arrest and taking the cops taser and shooting it at them is an attack  My god I would never want to be a copit was hard before but now its plain ridiculous,0,2020-11-13 10:40:59.345294,433
Jason-wp6gr,1 Dont drink and drive 2 Dont point any weapon at the police,0,2020-11-13 10:40:59.345294,66
keaka560,Why did suspect resist  take the tasor aim the tasor at officers  This turned ugly when suspect resisted arrest That seems to be left out  on most news channel  This is much different than George Floyd case where it was blatant brutality ,0,2020-11-13 10:40:59.345294,245
cristianruiz8082,Hey CNN how about that clip where he took a taser and nearly incapacitated an officer,46,2020-11-13 10:40:59.345294,86
peace2256,Unjustified killing,5,2020-11-13 10:40:59.345294,21
ADURANT42,You dont mention the Officer had to wake him up on three occasions,0,2020-11-13 10:40:59.345294,68
carlharrison3637,40 mins from start to end He was drunk He resisted He ran away If Wendys had not called the Police Rayshard would no doubt have crashed the car possibly taking out  a family on the sidewalk or someone one or more persons in another car Police were 100 innocent and Im not a fan of the Police but call it what it was,0,2020-11-13 10:40:59.345294,327
robdlc2247,"What happen to shooting in the legs For christ sake life is precious that man has a momdad and other people thats gonna suffer

You had a back up cop with u shoot the legs why killed him over a taser",0,2020-11-13 10:40:59.345294,212
michaelthomson9461,The guy was clearly in the wrong What I cant quite understand in all of these cases is why do the cops seem to shoot to kill Surely it would make more sense to just mame someone  This doesnt seem to show all aspects of footage available elsewhere which does show him resisting then fighting the officers taking their taser and firing it at one of them so yeh its a whole lot of bad choices yet again by both sides but this on the face of things isnt a racially based event,0,2020-11-13 10:40:59.345294,483
patrickbarnes2686,Let him run u have his car and all his info dude is running away not toward the police,0,2020-11-13 10:40:59.345294,89
eduardotrochez1215,Honestly I blame the media for all this messthey are the ones segregating,22,2020-11-13 10:40:59.345294,78
ericcartman6724,"He armed himself with the cops teaser
The teaser wont kill the cop but you have to think if he grabbed the teaser and he shoot the cop with the teaser whats stopping him from going for the cops gun next 
Everything was going good until HE wanted to fight with policeHe should have just went to jail I mean he was breaking the law drunk and passed out in a running car",0,2020-11-13 10:40:59.345294,377
jimkozenchik7473,Lets see everything was going just fine up until the point he decided to resist the arrest and fight with the cops the cops even started out with non lethal approach to get him under control and cuffed he over powered the cops they were trying to use there tasers but unfortunately the perp took the cops means of non lethal force had the intoxicated perp actually shot the cop with it and subdued him he could have had alot of possibilities to disarm the cop of his firearm and mind you he is under the influence of alcohol and his mind is obviously not thinking right because he has already resisted the arrest and started the fight with the cops you have know idea what he is capable of doing especially being intoxicated,4,2020-11-13 10:40:59.345294,736
ROBMACDUI,So a drunk gets into a fight with 2 officers slaming one to the ground steals a weapon and turns to fire it back at cops as he runs away and nobody can inderstand why he got shot,1,2020-11-13 10:40:59.345294,182
3PacBack,They had no reason to arrest him if he passed the breathalyzer,0,2020-11-13 10:40:59.345294,63
dcamron46,Brooks is 27 He looks 45,0,2020-11-13 10:40:59.345294,27
iantruhler701,They literally removed the clip of when the guy grabbed one of the cops tasers and fired it,267,2020-11-13 10:40:59.345294,91
zevermoon,So in this situation someone called 911 because hes passed out in the drivethrough line  Police arrive test him for sobriety  Subject refused to complete the test  The police are Aresting him for suspicion of intoxication  During the arest subject starts to resist  Police can no longer use a takedown hold  Subject get a hold of a tazer starts to flee the area with a dangerous weapon  While fleeing he aims the tazer at a officer in a threatening way  As a last resort the officer shoots him  Thats self defense,0,2020-11-13 10:40:59.345294,525
mileyan24,As a black person I dont think this was race related at all but I also dont think the officer needed to fire at someone fleeing when 1 He was too far to be of a threat with a taser and 2 The officer could have shot him in a non lethal location,0,2020-11-13 10:40:59.345294,249
TheRyanthunder,Anybody mind telling me why he was arrested,0,2020-11-13 10:40:59.345294,44
TorontoJon,NO ONE regardless of race colour or creed has the right to resist arrest to assault police officers or to steal an officers weapon gun baton Taser etc You dont have a right to lay one finger on a police officer or to dump buckets of water on an officer etc as weve seen recently because that is ASSAULT and stealing a weapon is THEFT and ASSAULT and therefore police are fully justified and authorized to respond with the use of deadly force if necessary,1,2020-11-13 10:40:59.345294,476
bsrcat1,They armchair quarterback is forgetting one thing and this video is short They asked if he had any weapons and he got a quick pat they never got a chance to do a search incident to arrest because you dont do that until a suspect is in cuffs What they and everyone knows is he was compliant and officers respectful until he initiated noncompliance and resisted arrest fir a violation he then assaulted 2 officers he then took a taser which became a weapon of opportunity fled and used it shooting at police as he fled So a violent aggressor who just assalted police with a weapon of opportunity and no problem using it against police gets shot That is what is happens when you make decisions like this Had he ran no weapon and the shot him i would be grilling the police Had the police acted in any way other than a professional manner or treated him with less respect due any person of any race i would be again grilling their asses What i am not going to do is give Mr Brooks a pass on decisions he made leading up to his arrest you do something even something stupid own that shit like a man I damn sure am not gonna give him a pass on the resisting arrest assault commandeering a police use of a police weapon at police And i am definitely not going to give him a pass just because he is black and the cops are white,0,2020-11-13 10:40:59.345294,1344
rvlucky2909,I have one question did they have to shoot to kill could you not shot him in the leg,7,2020-11-13 10:40:59.345294,84
rogjerr,Poor Arbery  He was just jogging thru after they kneeled on his neck,1,2020-11-13 10:40:59.345294,70
billybackfire2977,How can you VERY violently attack two police officers grab a Tazer off them and not expect to be shot,0,2020-11-13 10:40:59.345294,104
learneroftruth8025,"You shot and killed someone in cold blood from behind while theyre running away just because they were slightly impaired  WTF

Theres a name for this its called first degree murder  Im ashamed to have ever been a police officer  Theres way more criminals wearing blue than I had ever imaginedwow",1,2020-11-13 10:40:59.345294,313
annmariecooper5606,Make  an effort to demonstrate love it would make your country a better play,0,2020-11-13 10:40:59.345294,77
comicomi4451,Bad decisions meeting Bad Practice,0,2020-11-13 10:40:59.345294,37
jkfu7641,If hes running away did he get shot in the back,32,2020-11-13 10:40:59.345294,50
hollywoodcheremonkey,It sounds like the cops will definitely walk on this one and Im ok with it Resisting arrest like that is just crazy I wouldve expected being shot if I were the black guy,0,2020-11-13 10:40:59.345294,175
CalinSava,I swear American police is absolutely messed up I get it he was in the wrong but wtf actually kill a man that was unarmed they checked him  just because he stole a taser gun and ran off Let him run ffs you have his car with all his documents you will get him eventually And to see comments from people trying to justify that he was in the wrong like he deserved losing his life for something like that is absolutely mindblowing I hope that never happens to yourself or someone close to you Unfortunately people realize the issue only when they are directly affected by it,1,2020-11-13 10:40:59.345294,583
olyolu2337,Exactly  ,0,2020-11-13 10:40:59.345294,11
Smullet90,So the guy was driving drunk resists arrest steals a taser runs from the police shoots them with the taser and somehow theyre the bad guys for shooting him,0,2020-11-13 10:40:59.345294,162
bryantoth5249,So lets look at this If he wasnt a criminal  And if he didnt have a warrant hanging And if he wasnt drunk driving And if he didnt fall asleep in the drive thru And if he didnt resist arrest And if he didnt assault the police officers And if he didnt steal the taser And if he didnt evade arrest And if he didnt try to shoot the officer with the taser He would be alive today,0,2020-11-13 10:40:59.345294,395
sophieperaaud471,THE COPS ARE TAKING ORDERS FROM THE BUNKER,6,2020-11-13 10:40:59.345294,42
joetallon4968,A perfect example of what not to do when interacting with the Police The shoot was justified Police have the right to protect themselves,0,2020-11-13 10:40:59.345294,139
seagitwibo7967,The police shoot and killed a man who is unarmed and running away from the officer Unbelievable,0,2020-11-13 10:40:59.345294,97
rightfitfitnessperformance8209,cnn needs to show the whole clip This can be taken out of context in both ways,0,2020-11-13 10:40:59.345294,80
kelleypearson1493,Far too often Police shoots a guy running away cause they dont want to chase You will eventually catch the guy Sure he took your Less Lethal from you should he then be captured with a Most Lethal,0,2020-11-13 10:40:59.345294,206
stefanmansson6734,He took BOTH of the teasers and fired one upon the Police The media lies abot this fact until its a blatant farce,0,2020-11-13 10:40:59.345294,116
benjamin81too,he is on the run   you have his car  where is he going  I mean why shoot a gun at him  Go ahead make up some reason because you already know he is unarmed next time just go wait at the persons home,9,2020-11-13 10:40:59.345294,205
MrDavison282,He was armed after he took the cops tazer And then he fired the tazer at police you know a tazer is used to incapacitate right How do you know he didnt think he had the cops gun In the heat of the moment you arent examining the weapon you just took  why did this guy fight so hard I cant see it being for dui alone,0,2020-11-13 10:40:59.345294,326
MrAudienceMember2662015,"Id like to see the part where he fails the sobriety test 
All I see here is the man balancing on one foot No idea how long he was doing it Frankly I cant do that for very long on my best day which would be under half a minute",0,2020-11-13 10:40:59.345294,233
stephenmac3105,Got what he asked for,0,2020-11-13 10:40:59.345294,21
glditrapani,In Europe things like that could not happen here Police doesnt handle guns easily and had more respect for the life of people One more thing if you shoot at the back of someone its always a crime because theres not threat if someone is running away and unarmed This officer was incompetent,0,2020-11-13 10:40:59.345294,295
josephsmith6777,I do feel like they are making it worse,0,2020-11-13 10:40:59.345294,39
mzdaughtry619,Why does him being drunk and fleeing from the cops warrant his death,35,2020-11-13 10:40:59.345294,69
7xela,Great video proof that police action was totally justified,1,2020-11-13 10:40:59.345294,59
insignificantbunch9384,The cop was justified I feel sorry for people who think otherwise They think they can assault cops take their taser and point and shoot it at them If yall think that yall gonna take these types of L s  every time The guy would of set in jail till he was sobered and let go for a court date,0,2020-11-13 10:40:59.345294,299
sterlingkart9562,"These cops dont know how to detain somone properly 

We need to train officers proper  CQC and some JiuJitsu just to hold a person down From there detain the person place them in the car",0,2020-11-13 10:40:59.345294,191
agrainofsalt4889,"What we dont see here rayshard running AWAY from the cops and getting hit from behind
This was a murderer",18,2020-11-13 10:40:59.345294,108
lulufune1489,Youre not telling the whole story CNN,50,2020-11-13 10:40:59.345294,42
easternlighthouse5741,Didnt the man steal and use a taser on an officer Show the rest of the damn video,66,2020-11-13 10:40:59.345294,84
ronmckay8361,Why are non violent Crimes that have not harmed anyone end up with the suspect in cuffs and dragged off to jail The Police had his Identity his Car and he was cooperating Write the guy a ticket tow his car and call him a Taxi to get him Home safely The man did not have to die and the Cops overplayed the situation by a long shot,0,2020-11-13 10:40:59.345294,336
Goodoldm,These police brutality and excessive force encounters are not isolated incidents They happen because of poor and or incorrect training  Gezz reform cops from top to bottom   Protests will not stop until cops behave professionally more like military police ,0,2020-11-13 10:40:59.345294,264
strawberryari3197,Its the same story just a different name the hate you give 2018,0,2020-11-13 10:40:59.345294,67
kenmasters2231,Starting to think these news organisations are paying these cops for footage like this to create these situations,1,2020-11-13 10:40:59.345294,114
kylebslife7910,Just do not resist arrest and you would not be shot,1,2020-11-13 10:40:59.345294,51
HustleBoneApparel,His foot was on the brake still he probably wasnt sleep,21,2020-11-13 10:40:59.345294,56
Sturmavk,A MAN thats drunk driving gets questioned for 45 minutes by two very respectful officers The man fails a field sobriety test The man then resists arrest and commits 5 to 10 different felony assaults on officers Its abundantly clear to all that have watched the full video that the man is clearly winning the brawl versus the two officers The man then wrestles a weapon away from one of the officers The man then fires that weapon at the officers and gets shot The man got EXACTLY what he deserved His skin color is meaningless,1,2020-11-13 10:40:59.345294,536
