username,comment,like,date,comment_length
jackjolly789,Im not from the US but I sure as hell know not to point a weapon at a cop Its extremely senseless,160,2020-11-13 10:40:59.345294,101
DenverEight,I remember in Captain Planet Matis power of heart linked the other planeteers on an empathic and telepathic degree His teammates understood and linked together to quickly assess problems and then possibly summon Captain Planet The key to it was Matis own will that anchored and drove the team to their goals,0,2020-11-13 10:40:59.345294,313
jhartmggc,Its tragic how this all unfolded Unfortunately once the officers suspected a DIU they had to follow the rules Changing laws for minor crimes like DIU where the car is impounded and the suspect is ticketed and told to report to court instead of being handcuffed and arrested would have avoided this confrontation,0,2020-11-13 10:40:59.345294,316
datofficial6062,We dont need his help to understand what were seeing what we need is a full uncut video to judge for ourself what were seeing,289,2020-11-13 10:40:59.345294,131
panthercub10,You know it odd but the more this happens the more I start to see and hear people give any excuse to take another persons life,1,2020-11-13 10:40:59.345294,127
thomasgurgal6438,I have been in a similar situation after an office party The police drove me home and that is what should have happened here or they should have let him call family Nothing he did was a capital offence Police  dont get to be judge jury AND executioner,1,2020-11-13 10:40:59.345294,262
cynthialangley7338,I dont even know what to say If this is standard operating procedure then we definitely need to make major changes asap My condolences to the family,19,2020-11-13 10:40:59.345294,152
jjburkk,Theres a time and a place to fight the police  Its called a court room,41,2020-11-13 10:40:59.345294,74
triadi5876,May He rest in peace,0,2020-11-13 10:40:59.345294,21
bertreynolds8146,Can you imagine if CNN was the only place you were getting news Youd know absolutely nothing about nothing,38,2020-11-13 10:40:59.345294,108
SIl_Ae,"I always ask myself the same question when it comes to police shootings Dont they train to know where to aim

Theres a massive difference in aiming at someone with a deadly weapon assaulting you and chasing someone The guy used a taser the officer probably panicked its understandable that maybe he lost composure in that moment But this is a prime example of a where police training fails  b why police shouldnt be armed",0,2020-11-13 10:40:59.345294,437
agonzalez8924,You conveniently left out that in the struggle he also ripped away a taser from one of the officers and was actively trying to use it,64,2020-11-13 10:40:59.345294,135
milaniinalim3357,He was drunk and acted irrationally when panicked but he still didnt deserve to die so many people have done worse and are still alive,103,2020-11-13 10:40:59.345294,136
NeverCanDecide,How can you try fight cops steal their weapon and be susprised that they shot you lol,30,2020-11-13 10:40:59.345294,86
janellebentley2002,Well analyzed and the cops were definitely embarrassed We need a conviction,0,2020-11-13 10:40:59.345294,76
mattfoley7881,If you resist arrest you take a chance  If you grab an officers weapon you take a chance  If you run away from officers who apprehended you you take a chance  If you aim a weapon at an officer you take a chance  When you do all 4 youre flipping a coin as to whether youll come out alive,3,2020-11-13 10:40:59.345294,299
justinleet3639,The fact this is what you choose to cover shows your true intentions,85,2020-11-13 10:40:59.345294,69
ezdoesit20,The fact that she said white officers and a black man is the problem,405,2020-11-13 10:40:59.345294,72
wwhinshort912,Teach everyone to respect human To respect life To live and enjoy life Stop these kind of behavior,32,2020-11-13 10:40:59.345294,102
paulreed3778,if you drive under the influence which puts other people in danger and then get punished for it thats how life works If you try to avoid said punishment and force an altercation like this then in the event you are shot andor killed you brought all of it on yourself Decisions have consequences,0,2020-11-13 10:40:59.345294,297
davidpaglia1326,Almost the same thing happened to me but cop took my keys and told me he would be back in an hour I went into store had a cup of coffee cop came back asked me if i was alright and gave me my keys That was 1981 Back in those days it wasnt all about filling town coffers,0,2020-11-13 10:40:59.345294,272
torybradwhite7384,I always wonder why CNN never shows the whole CLIP JUST spiced sections together Really hard to believe them on what they do show when they have so much they dont,51,2020-11-13 10:40:59.345294,166
donnacouch7430,he got what he deserved    the video shows that the police officer was doing his job    thanks for your job well done police officer     GOD BLESS you all out there  ,0,2020-11-13 10:40:59.345294,174
vlogsusa144,Feel bad for the guy,0,2020-11-13 10:40:59.345294,20
extramind6969,There is something really wrong with the police in the States Things like this are happening once in a decade here in Europe,10,2020-11-13 10:40:59.345294,126
MattGaetzOnAWhiteFordBronco,"Im so sorry for this man Being drunk and resisting arrest is not a reason to get shot That being said you have the guys car and patted him down 

Police LET HIM RUN He was gonna get caught Follow him around on your car to prevent him from getting hurt or something Its amateur hour with the police",0,2020-11-13 10:40:59.345294,309
medaanhil4133,I had a real conversation with some nice white folks I worked with about situations like this This guy actually told me a big tip They hardly ever got arrested for drinking and driving because the local cops knew them and their families and would just let them go Why,0,2020-11-13 10:40:59.345294,271
bhrondapinder4091,This is causing anxiety that its literally making me sick,2,2020-11-13 10:40:59.345294,59
eliascastillo1641,Resisting arrest is never good neither is pointing and firing an object at night at an officer Sorry for his death but a little wise decision making goes a long way People need to learn you resist in court not in the street in the middle of the night,16,2020-11-13 10:40:59.345294,255
shukrih1404,This is beyond any comprehension He was compliant and was not endangering anybodys life Why use such deadly force,0,2020-11-13 10:40:59.345294,117
hotrable,Regardless of him running away with the taser he shouldnt have been shot to death The police shouldnt be the judge jury and executioner over the decision to end an unarmed mans life,69,2020-11-13 10:40:59.345294,189
marieeab01,I live in the UK and cant understand why the police were called Im absolutely sure that staff here  would have tapped on the window and asked Sir you want to order and if he didnt wake it wouldnt be the police  theyd call it would be an ambulance,0,2020-11-13 10:40:59.345294,255
ginagay5860,PRAY for the world right nowit needs it,30,2020-11-13 10:40:59.345294,43
ajcutler3472,"APD SHOOTING EXPLAINED
Before reading below remember that officers are afforded the same constitutional rights as citizens so whether theyre charged for political reasons or not the facts of the case remain the same until their day in court",2,2020-11-13 10:40:59.345294,246
kokiketili,I am not the police but one thing I know is if someone is running away you dont kill them you chase them down They found no weapons on him and the police were not in any immediate danger This mans life mattered PERIOD,0,2020-11-13 10:40:59.345294,227
zurdoremi,the suspect resisted fought with the cops supposedly took a taser from one of the cops tried to escape then turned around and fired the taser at the cop This is not a Floyd case The cop had no choice Its all clear in the video,18,2020-11-13 10:40:59.345294,235
MrLediogjergjani81,How can someone running away from you pose an imminent threat,18,2020-11-13 10:40:59.345294,62
NlCKED,So the suspect is driving while under the influence of more than two times the legal limit resists arrest steals and points the officers taser at the him and people think this is okay,75,2020-11-13 10:40:59.345294,186
gmanon1181,"The police in this case was clearly seeking for an excuse to kill this man  How in the world could we call those individuals law enforcement

These practices are obviously deathly wrong and are nothing but lynching",0,2020-11-13 10:40:59.345294,219
unclesam8451,"Hi there Im Rashard Brooks I was sentenced to 7 years in prison for beating my KIDS I was paroled due to the covid19
I drove drunk to Wendys and passed out in the drive through line when a cop tried to arrest me for my 2nd dui I stole his taser and fired it at him because I knew I would be sent back to prisonIm a martyr now",69,2020-11-13 10:40:59.345294,340
Darell2710,Yes he made a mistake but there was no reason for the police to shoot him You could always catch him another day and give him the additional charge of having resisted arrest In the military I was taught that a firearm during peacetime is meant for protection and only discharged when there is an imminent threat towards you or the people you are protecting You are supposed to meet the escalation level attempt to deescalate and never to escalate further A taser may have been a threat as seen in the extended version of this video but not one that requires an immediate use of a firearm Furthermore shots should be made to disarm and not to kill Shooting and killing this fleeing criminal made the police the judge and the jury on that mans life If they had let him go then the law would still have caught up with him eventually Not all criminals deserve the death penalty,0,2020-11-13 10:40:59.345294,894
MrRayMac1963,For years weve seen drunk stops aired on cops where the guy runs away and they never shoot him in the back  So as wrong as Brooks was and he is very wrong this never should have got to the level of lethal force,2,2020-11-13 10:40:59.345294,217
revolutiondance1141,Imagine if the cop just said we will have to give you a ride home you cant operate your vehicle for the night But not in this day and age where all of this at the end was about money not justice but money America is not a country its a business,16,2020-11-13 10:40:59.345294,249
marcusbarnes2736,Its sad to hear that this man was shot and killed by a police officer but at the same time do not put yourself in a situation to were u going to make it harder on yourself Just corporate in the best way that u can and dont give any police officers a reason to take out their guns,0,2020-11-13 10:40:59.345294,283
GO-GO_SO-SO,I wish they would do a story on what happened to Breonna Taylor  She was an EMT shot in her own home by police during a noknock raid,26,2020-11-13 10:40:59.345294,135
jeanettehinds4253,The officer should of taken control of him from the first second Hes walking up and down telling the man to keep looking for his license Its so frustrating Theyre either putting their foot on your neck or theyre walking around like you are their best friend Just do your damn job Thats what the public wants We want you to follow procedure and then you go home and they either go home or to jail But at least all concerned still have their life,0,2020-11-13 10:40:59.345294,457
robotron17,"There may have been some confusion as to what weapon he grabbed from the other officer
Did he just grab the taser or did he also get a gun Rayshard brought this on himself",8,2020-11-13 10:40:59.345294,175
noahedmonds83,I pray for his family but just comply people its easier than losing your life over something simple,0,2020-11-13 10:40:59.345294,101
The_Fumbles,Im not saying its right but resisting arrest is never a good idea,113,2020-11-13 10:40:59.345294,67
nazariog.1155,This dude should have just complied and should have let the cops arrest him If he thought he was innocent he could have fought it in court They only hold you for 8 hrs in the drunk tank he could have just done his 8 hrs gone home and get a lawyer instead he wound up dead which is sad I pray that everyone decides to change and make the right choices for the sake of their own health and the health of others,0,2020-11-13 10:40:59.345294,416
gustavosuarez3096,We need to apply across all states similar rules of engagement as it is written under the Geneva Convention I am confident that only 90 off the entire police force does not follow abide by their states law There needs to be a rule that governs all in which officers are hold accountable the same way as in the military That way that are disciplined at the highest level in which they will comply and obey Its all about discipline and these officers do not have any,0,2020-11-13 10:40:59.345294,476
beecee7488,Smh  Why did he resist  Clearly this could have been prevented,0,2020-11-13 10:40:59.345294,67
calebkopitsky7611,The punishment for assaulting an officer isnt death He was running away when they shot him He was not a threat to the officers health at that point,29,2020-11-13 10:40:59.345294,152
silverjones2317,How difficult is it to know that YOU DONT RESIST ARREST,1,2020-11-13 10:40:59.345294,59
galaxyxss2881,Im sorry for what happen but thats way different from what happen to George Floyd That guy shouldnt have done that,38,2020-11-13 10:40:59.345294,118
SonnyBCreative,The officer was too focused on getting the arrest The man was drunk and calm So I think the officer didnt have to rush to arrest him He tried to handcuff him in a few seconds I feel this couldve had a very safe outcome if the officer wouldve kept a calm pace and explain the the guy first then arrest just as he took time to explain and confirm about the breath test  The man may have turned around by himself and surrendered,0,2020-11-13 10:40:59.345294,436
menghic531,Very sad ending   First of all the suspect is mainly responsible for his own death  Get out of the car and comply with the police  You dont fight with the police take any weapon and run Yes a taser cant kill you  but you mustnt take anything from the police  What was the purpose of said action,1,2020-11-13 10:40:59.345294,308
ladyslovelucas82,They woke him up told him to pull over to a parking spot and get some sleep but then he passed out again then the cops woke him up again and started questioning him That was cut from the video,1,2020-11-13 10:40:59.345294,194
rogerdread38,We must always look within ourselves frist And make the changes Starting to show love between ourselves Then well see the real changes,4,2020-11-13 10:40:59.345294,138
ariraquel4567,They edited out alot of footagethe police were not mean to him he chose to resist arrest after approximately 40 mins of talking calmly to him,0,2020-11-13 10:40:59.345294,143
Machinedead,He could have just gotten away with a night in jail and maybe losing his drivers license but he just had to resist arrest and run away with a taser and then shoot it at the police  Huh    ok that was stupid dude  Guy nust have been really drunk or really high on drugs,11,2020-11-13 10:40:59.345294,282
youracherrynut442,this ones contentious but I think we can all agree that he didnt have to lose his life given that he was initially cooperating and interacting with the officer in a friendly manner,0,2020-11-13 10:40:59.345294,183
dub3140,The sad thing isis he could have refused the breathalyzerThey were not sure what he was doingThey didnt suspect he was drunk at firstAnd they didnt catch him driver drunk eitherJust parked restingThey didnt have to do anything but drive him homeInstead they chose to go this route smh,0,2020-11-13 10:40:59.345294,292
DarthJeremy364,seeing the comments for this video gives me hope for humanity,3,2020-11-13 10:40:59.345294,62
tsu8003,Theres a 43 minute unedited version of the police cam that shows 41 minutes of an ordinary decent police officer doing his duty politely and courteously and 2 minutes of a criminal resisting arrest,0,2020-11-13 10:40:59.345294,199
BlessedIndeed1,I was pinched for DWI over 30 years ago by 2 white cops I was polite and listened to their commands I ran a red light and was pulled over They were justified in pulling me over Went to the station and met the lieutenant A gentleman who treated me with respect He was doing his job Did I curse him or threaten him or his officers No They noted this to the judge I still had to pay a price Yet I am alive today to speak about it,0,2020-11-13 10:40:59.345294,438
bananascoconutvr3271,"And this is the attitude of so many shoot someone if theyve done you wrongif someone runs away  with your walletpurse do you shoot them
How you answer determines what side of humanity  you really are on 
Awful and another example of why we need complete overhaul of the justice system",9,2020-11-13 10:40:59.345294,303
JeremiahMuchangi,"Traffic offenses in some developed countries are handled by CCTV and mailed fines 
However a minor traffic violation like a bad light bulb is likely to get guns drawn and unnecessary interactions with multiple police units turning up in gun republic",0,2020-11-13 10:40:59.345294,252
SteveReason82,If he was in Wendys drive thru what was the point of checking his person They could of simply told him that hes  drunk and that he either needs to call for a ride home or stay the night in his car at the Wendys until he sobers up Why were they trying to arrest him if he wasnt even on the road driving,0,2020-11-13 10:40:59.345294,309
michaelsuder3956,Im wondering if he had a little something on him that he shouldnt have A DUI isnt a huge offense  especially when youre just sitting passed out in a drive through,0,2020-11-13 10:40:59.345294,168
Jeff-kw8jj,The suspect held all the power in regards to what happened during the investigation   At any time he could have submitted  Too many suspects believe they can stop an arrest they cannot  Submit to the arrest and fight the charges laterif you dont think you should be arrested DO NOT FIGHT TALK TO OR RUN FROM THE OFFICER IT IS NOT THE TIME,0,2020-11-13 10:40:59.345294,351
sue9038,We all are free to choose our sins  not the consequences  of those sins,0,2020-11-13 10:40:59.345294,73
mrphysics2625,"amazing how so many ppl claiming its just a taser that he stole dont seem to know what happens to a person that gets tased

he aimed it back at the cops while running away which is shown on the wendys security camera footage",31,2020-11-13 10:40:59.345294,228
MrDank132,If he had cooperated he would still be alive They were treating him with respect until he tried to run and then shot at them with the tazer He shouldnt have been shot but honestly thats what theyre trained to do so its not their fault Its the laws and training in that area Why did he run,55,2020-11-13 10:40:59.345294,298
JohnOhkumaThiel,Im on the side of the victim overall but from what Im seeing both in these videos and others is that everything was fine until they tried to put the handcuffs on him then he resisted grabbed the cops taser pistol took it ran pointed it back at the officer that was chasing him with the intention to tase him and then he was shot with a firearm,1,2020-11-13 10:40:59.345294,354
bri9146,If they didnt want to deal with it that day they could have said  call somebody to get you a lot of people get junk and fight all the time They have no judgement He had no weapon but taser,0,2020-11-13 10:40:59.345294,195
karyn19,Imminent threat includes him incapacitating an officer with the tazer and then possibly gaining posession of the service weapon Split second like that he had already showed himself to be willing to steal a weapon and use it,12,2020-11-13 10:40:59.345294,226
bekind5044,I wasnt there but I think the officer should have offered him a ride home Perhaps ask the driver to call for a ride and tow his car  Just trying to arrest wasnt the answer  I understand he was drunk but he was not not diving at the time of incident sleeping in the car  God help us as a Nation,1,2020-11-13 10:40:59.345294,302
metallicak5,The guy fired a taser at the police At that point youre in the wrong buddy,16,2020-11-13 10:40:59.345294,79
jasonargonaught8744,I dont know if anyone is catching it but the cop who was chasing him had already stuck his taser cables into Brooks It looked like he was running with those attached and at some point he pointed the taser that he grabbed as a way to ward off by maybe trying to distract the cop so he could put distance between them I also am wondering from some of the other footage it looks like the cop pulled out his taser and hit him with it and Brooks grabbed it to keep it from being used against him Then decided that it might be best to take it with him as he ran away so that it couldnt be used to electrocute him as he fled,0,2020-11-13 10:40:59.345294,624
tonyb9185,You do not have to do the field sobriety testas you can fail it for normal reasonsthey can not make you do it,0,2020-11-13 10:40:59.345294,111
Usernameusername206,Why resist arrest If you are innocent sort it out at the jail People think oh Im going to get physical and they will let me go Stupid,1,2020-11-13 10:40:59.345294,143
sas9577,I applaud the officers for the way they handled this You dont resist arrest because youre drunk He even assaulted the an officer while trying to be contained and stole a taser and fired it upon the officer  Everyone who thinks this was handle wrongly what if the story changed and the person driving drunk hit and killed someone then what The outcome is sad but the person should of just went to jail his actions caused him to end up being shot and now hes dead,0,2020-11-13 10:40:59.345294,470
Strength_In_Wisdom,I dont know how many have seen this story on CNN But the cars moved after rayshard was shot once The same officer proceeded to walk  his way to Rayshard Brooks still living body and shot him in the back again,0,2020-11-13 10:40:59.345294,214
tlhaloyn8485,Let that man run away You have his car and his info Dont shoot that man in the back for a minor or major offense,64,2020-11-13 10:40:59.345294,116
belescli,Even if he had a gun why do they shoot at him Why cant they run after him or just let him go They have his car there to get his identification so that they can deal with him later  How sick is the mind of police to think they can just shoot someone because a person did not subject to them Sick,0,2020-11-13 10:40:59.345294,304
JavierFernandez01,This makes sense I was struggling with this one But that last 20 seconds or so really drove the point home,1,2020-11-13 10:40:59.345294,109
thomwessels2281,Just terrible that lethal force was used If he just wasnt drunk blocked a business failed a FST resisted arrest fought with them to get away TOOK THE LEOs TASER FIRED IT AT HIM while fleeingnone of this would have ever happened,1,2020-11-13 10:40:59.345294,240
petergraziano5146,In Canada hear they usually first will block his car so heshe cant drive off then they will ask questions while you are in the car At no time do they allow you to get out of the car until more officers arrive At that point they might put handcuffs on you for the safety of both parties It was wrong of them asking him to get out of his car before asking him questions,0,2020-11-13 10:40:59.345294,373
socialbuttfli78,In this day and age it is NOT beneficial to your health to run from the cops AND fire a taser at them  The cops shouldve just caught up with him later on when he came home to make the arrest His life saved and money in their pockets,0,2020-11-13 10:40:59.345294,236
zebontheweb,I like drinking but I dont get behind the wheel when I do it  Dude was so drunk he fell asleep with the car running  At that point the police have to do something and you have to admit theres a problem,31,2020-11-13 10:40:59.345294,210
youjunshi5329,Holy shit What a tragedy,0,2020-11-13 10:40:59.345294,26
callmecaution1,How people are saying that the police shot him because he is black is absolutely mindblowing to me They gave him 3 opportunities to pull into a parking space without a breathalyzer Dude totally escalated the situation on his own,0,2020-11-13 10:40:59.345294,231
robinsmith979,They had a reason to shoot him during the fight but they had no reason to chase him and shoot him down since they had his ID Its not self defense if you chase and kill a person whos in possession of a non lethal weapon while you have a gun,9,2020-11-13 10:40:59.345294,243
daphnewheeler470,Why didnt they show the part where he was speaking to them admitted that he had a couple drinks told them he had no problem walking home and that his sister lived close by He tried to reason with them and they still insisted on arresting him,0,2020-11-13 10:40:59.345294,246
loudbeep,If you watch the full video from the Wendys camera the officers chased him down on foot and only shot at him after Brooks discharged the taser at them and headed for a car in the drive through,0,2020-11-13 10:40:59.345294,195
Faisal600,This is another reason why cops should be trained on deescalating situational procedures and communication,27,2020-11-13 10:40:59.345294,106
sebastiansoto9972,The Chief mentions the protocol for when deadly forced is authorized via policy that stems from Tennessee v Garner if you want to read up on it All he had was 1 shot of the officers own taser should not have escalated to the point it did It was a bad shooting per policy which is why it was a clear cut case for the police to have him turn in his badge and face charges,0,2020-11-13 10:40:59.345294,377
scottishroad_pinoy9084,In fear of imminent to your life or the life of another to use deadly force All cops should know that We took the same test before going into law enforcement Common sense and a heart is whats lacking What clouds these cops minds are power behind the uniform and their guns Their true characters shows No one used their heads sad a life is gone,2,2020-11-13 10:40:59.345294,354
