username,comment,like,date,comment_length
jasongarcia3859,Im all for the movement but Im sorry this guy should not be used as an example of criminal justice reform The dude clearly resisted and tussled with the cops on the floor shot the taser at them  You can try and spin this however you want saying but he was running away yadayadayada That dude wouldve gotten capped in any country around the world no question He was wrong and the movement needs to keep its focus on unjust murders,0,2020-11-13 10:40:59.345294,437
andrewedwards1371,Of course they didnt show the full video Terrible reporting to accomplish a goal,0,2020-11-13 10:40:59.345294,83
MrErgenta,WTF I love the framing they went with in this video He didnt have a weapon when they search him therefore he never had one except when he grab the taser from the cop CNN did an oopsie and left that part out,0,2020-11-13 10:40:59.345294,216
stevenbecker3396,Yet no one calls out the fact the dude punched the cop in the face  ,1,2020-11-13 10:40:59.345294,69
arthurvardanyan6594,He assaulted the officer Stop making this about race,12,2020-11-13 10:40:59.345294,54
tammysmith928,If you would be honest show the part where he turned and fired the taser at the police and that was the exact moment he was shot I watched the beginning of the video where the officers were extremely polite and calling him sir They spoke kindly to him Nothing derogatory or racist But think of the backlash those same officers would face if they had let him go and he killed someone while driving to his next destination as suggested by some Would someone at CNN stop trying to stir up hatred long enough to realize what you are doing to our country What exactly will you be king of when you win Tell the whole story not just the parts that suit your agenda,0,2020-11-13 10:40:59.345294,668
mgmassey174,"If you treat humans as if their life is insignificant 
you are denying that God made us all

If you fall for the divide and conquer crap youre not paying attention",0,2020-11-13 10:40:59.345294,168
samwiseadah7938,Is it a must to get him at that moment I dont get it If you want to get a guy who is not armed with weapons and he is not a fugitive or has previous serious issues to answer for If he flees do you have to kill him Cant you get him later or is there more to all this So if some someone flees from police unarmed and has not killed an officer just resisting arrest warrants been shot and killed It doesnt make sense I cant understand,0,2020-11-13 10:40:59.345294,447
alphajava761,Tase the cop and steal his gun like you did the taser  Mr Brooks just fought off 2 officers and forcefully took the taser  Mr Brooks was clearly a threat cops have died by letting a suspect take their gun,2,2020-11-13 10:40:59.345294,207
zacharypeacock6278,As a black man i hate to say this but this is a justifiable murder in the eyes of the law And the police will not be prosecuted for this Im sad that the brother lost his life and I understand how police treat us as black people because I have experience such treatment from a police officer But they are the law and when given a command we are supposed to follow their command And the brother took that taser and aimed it at them which made it lawfully for them to fire at him Now morally I dont think they should have shot the brother but by law they can do it and get away with it because of that badge that they wear on their shoulder,0,2020-11-13 10:40:59.345294,645
triggertitley6555,Here we go again,20,2020-11-13 10:40:59.345294,17
jonbeahan2874,All I want to know is  are they going to rebuild that Wendys,0,2020-11-13 10:40:59.345294,63
xiaoyang420,Im for BLM and against police brutality I saw the whole video The police did nothing wrong from start to finish They did the right thing to protect themselves But seriously 2 cops couldnt hold the man down and the man took the police tazer,7,2020-11-13 10:40:59.345294,248
josephsmith6472,The dudes asleep in a drive thru line Wtf,0,2020-11-13 10:40:59.345294,42
marv9906,And to think all he had to do do was comply Brothas never want to comply and when you use force they scream racism,0,2020-11-13 10:40:59.345294,115
locke2517,"He blew a 108 Not a 108
Thats a big difference Have some integrity jeez",0,2020-11-13 10:40:59.345294,77
Max-ph5in,Wheres the other body cam footage,32,2020-11-13 10:40:59.345294,35
johnnie62,Security camera footage showed he grabbed for the officers weapons and got his taser and he fired it Good to know you guys wont report that,5,2020-11-13 10:40:59.345294,142
TiredOfApathy,He was driving drunk resisted arrest swung a haymaker at a cop took a cops taser shot the taser at themCops should have done what exactly If you allow people to resist hit them steal their weapons what are you telling cops At what point would policing be a joke This guy increased to a level of violence What if he ran home to get a gun knowing that the cops would be coming for him What if he took a hostage he already showed he could be resistant Is it safe to assume he would be a marshmallow later What if he did all that cause the cops let him go What would the Media say about their decision to let him run with a weapon into the night to do more dumb stuff Would the cops be looked at as not doing their job if he hijacked a car got home and shot someone who came to arrest him later  I love how we are told that its OK to do harm and there should be nothing done Even the family attorney said Why not tell him to pull over and have him call an Uber Man I bet Moms Against Drunk Driving Loved that,0,2020-11-13 10:40:59.345294,1035
zootedone1234,wellhe should not have given them a hard timealso he took the officers stun gun and tried shooting him with it so his partner shot himsimple as thathe was far from innocent,0,2020-11-13 10:40:59.345294,185
JrobAlmighty,"So lets say a guy fights and runs Can law enforcement be held liable for not stopping him from running if he commits additional crimes

So they let him run and he kills someone in a car accident trying to get away Sure he didnt meant to but just let him go",0,2020-11-13 10:40:59.345294,262
abdirahmanyaya3969,Killing isnt easy just know that dont kill anything just stop killing it Wtf,0,2020-11-13 10:40:59.345294,79
richvandusen4284,This is why CNNs so called law enforcement expert no longer works in law enforcemenent,22,2020-11-13 10:40:59.345294,90
NOWWECAN,Really CNN It is criminal the way you edited this video You made it appear like he was asleep in the drivethrough and they woke him up and he immediately drove his car to a parking place You did not show how many times the officer had to go back and wake him up before he even moved his car You didnt show him punch the officer in the face You didnt show him try to shoot the officer in the face with the taser You didnt show the people in the parking lot that he was running toward with a weapon he stole from a cop What are you trying to do  start more riots CNN I supported you through all these years only to find out Trump was right You are Fake News,0,2020-11-13 10:40:59.345294,670
highstreetkillers4377,100  justified Cop did his job not really well since the criminal got a taser Good job Officer Democrats think the cop is suppose to ask him to return to a safe space lol I guess the cop was suppose to get tazered gun taken and murdered Thank you Officer hes a HERO,0,2020-11-13 10:40:59.345294,277
vinodraghavan67,"Play Stupid Games Win Stupid Prizes 
Police Had To Defend Themselves 
He was on Suicide Mission",0,2020-11-13 10:40:59.345294,96
octagontowers4267,This is highly misleading The guy here made THREE not one but THREE horrible mistakes 1 He got drunk thats why he passed out in the middle of parking lot 2 He resisted arrest and grabbed their taser I mean are you  stupid Whether you are right or wrong do not resist an arrest the one that WILL get killed is you not the police offers 3 The guy ran away making him look suspicious what did the officers do What any other person wouldve done try to stop him they shot him,0,2020-11-13 10:40:59.345294,498
Edward1312,They didnt need to kill him just because he was drunk and intoxicated He was shot dead because he was drunk and disorderly They should have let him run he wasnt a threat to anyone he wasnt armed and was running away He would have been picked up the next day because it wouldnt have been difficult to identify him Hell when he was sober he would have probably handed himself Just because he was intoxicated and resisted arrest it didnt give the police free licence to effectively execute him on the spot for what is a traffic violation effecting no one else The Police should not have the right to execute someone for that,0,2020-11-13 10:40:59.345294,635
KeruptKiller,Officers Police lives were NEVER in danger Officer took that man life because his feelings were hurt  Grow a pair and do your job or find a new one oh thats right you were fired ThatManLifeMattered,8,2020-11-13 10:40:59.345294,210
Anonx82,What happens if the cop was shot with the tazer and now is paralyzed his life is now in danger,0,2020-11-13 10:40:59.345294,96
theonetrueleaftheonetruele5781,By policy alone its justified This isnt the first time someone has been shot for taking a cops tazer Dont blame the officer advocate for policy change like trumps police reform,0,2020-11-13 10:40:59.345294,184
phinguyen-bt1zt,Obey the law and you are home right nowWhy resistpoint a gun and run He struck out 3 times Some officers are aholes but a little respect goes a long way,0,2020-11-13 10:40:59.345294,166
alexbarrios875,I know Shit is hard and 2020 is not a good year but they got this one wrong Resisting arrest and pointing a Taser with the intent to harm is a clear reason to defend yourself This one is wrong Atlanta I dont agree with Police Brutality and a lot of times they abuse their powers but this is a drunk driver that could have killed someone  the officer was doing his job,1,2020-11-13 10:40:59.345294,373
familiacajigas3507,Everyone crying over a justified shooting Not everyone just the non sensible people,1,2020-11-13 10:40:59.345294,86
janelamb8549,"Your lying again didnt show the whole thing where suspect assaults officerpunches officer and takes taser fights both officers
and even looks like suspect tried to tase officer Perhaps you want to  promote more riots Lousy journalism and you should",61,2020-11-13 10:40:59.345294,255
VuNguyen-my2cw,Of course CNN skips the most important factor of the video How convenient I encourage anyone who wants the truth to go find the version that is not edited to race bait you all,0,2020-11-13 10:40:59.345294,178
braderwin9620,"CNN edited the video I wouldnt expect anything less They are the masters at doing this
HAPPY BIRTHDAY PRESIDENT TRUMP",2,2020-11-13 10:40:59.345294,121
joooldanlor,"SAD but very simple 
HE DID NOT HAVE A GUN
NO TREAD TO POLICE
NO REASON TO FIRE",0,2020-11-13 10:40:59.345294,92
andjulia9292,Seems like the US Police could learn from some European countries that dont carry weapons,0,2020-11-13 10:40:59.345294,91
noozbumps7026,"Proper Police Reform 
Double their numbers Double their salaries 
Give them leaders that they can trust ",0,2020-11-13 10:40:59.345294,117
snjspring,This was not a racist cop Stop it CNN  shameful,12,2020-11-13 10:40:59.345294,50
kimandreskogstrand5004,People who talk about the taser clearly have not understood a god damn thing you still have no fucking idea why people are fed up And that is that all your excuses melt away as soon as you compare US police to any other civilized nations This is completely standard police work in all nations but its almost unthinkable that it could lead to someone dying in another country At best that makes US police incompetent is that what you defend and celebrate Having 2nd rate police officers yay,0,2020-11-13 10:40:59.345294,500
1845hunt,Im beginning to hate CNN You have to watch the entire video The officer was polite from the start Rayshard should not have taken his taser and then pointed back at the officer while running and even shot it at him Im sure all the officer saw was himself being shot at Rayshard was 100 wrong in this situation and got himself killed,1,2020-11-13 10:40:59.345294,338
minhokim766,This video is sickening Screen moved around so much it gave me nausea,0,2020-11-13 10:40:59.345294,72
hafadude69,I just like how CNN loves race bating They just have to make sure you know it was a white officer and a black man THIS HAD NOTHING TO DO WITH RACE The guy was drunk his story kept changing and he resisted arrest The cops were nice courteous and would of treated anybody the same way  Not sure how this could be the cops fault Resisting arrest should be a topic for discussion Do you know what would of happened if the let this guy go and he would of hit and killed someone with his car The cops would then be liable because they knew he was drunk,3,2020-11-13 10:40:59.345294,557
actionfleetsolutions7738,What was the crime Did it require deadly force I know it didnt why are the police not taught this This is murder clearly These aggressive police tactics need to be removed from policing God bless the victims,0,2020-11-13 10:40:59.345294,215
GOLDENEYE-sd8mc,Its really about race If the cops were black this wouldnt even be a story,14,2020-11-13 10:40:59.345294,77
sa9861,"As tragic as this is
Why was Wendys set alight",204,2020-11-13 10:40:59.345294,49
flowerpower7103,When does this ever end,17,2020-11-13 10:40:59.345294,24
robdanny5380,"Looking for someone who tells me if Im wrong if YES explain why
Well if they killed him during the fight perfect i shut up but they didnt so what reason they had to chase him and shoot him in the back He turned around and tried the taser Okay but its not deadly and it got a short range so if you have a brain why would you get so close to him",6,2020-11-13 10:40:59.345294,353
javierrios9934,Umm Wheres the rest of the clip Did someone edit where he punched the cop stole the taser ran off pointed and fired at the cop,46,2020-11-13 10:40:59.345294,139
Ksb88,This man was WRONG he was DUI and assaulted an officer This is why body cams are so critical,17,2020-11-13 10:40:59.345294,95
chrundlethegreat1960,Dont break the law You wont get shot Pretty simple,7,2020-11-13 10:40:59.345294,55
evitasdad,Everyone seem a bit trigger happy over there,6,2020-11-13 10:40:59.345294,45
crispark9797,yeah I am having a hard time with this one being a justified shootingYes he did turn the taser at an officer and shot itall officers are shot with the taser in the academy so they can experience it first hand but I think that is only so they are careful with voltages etcdid it warrant  lethal forceIm not sure because we didnt have tasers when I went through my trainingLethal force is only used when you feel your life or another life is in immediate dangerTasers only have two cartridges but in the hands of an untrained individual does it constitute as a deadly weaponmaybe,0,2020-11-13 10:40:59.345294,602
ElSmusso,They shouldve bought him a cuppa coffee  ,12,2020-11-13 10:40:59.345294,43
sarahhowes8759,lol they probably cut it short cause explained why the officers were in the right,0,2020-11-13 10:40:59.345294,81
dawngene4899,People are awesometry people are stupidlook at some of the comments in this comment section,17,2020-11-13 10:40:59.345294,101
josegenao7421,The cop should not use his gun bc his life was not in dangerperiod He should wait and get him in a different ways ,0,2020-11-13 10:40:59.345294,120
vinceochinero,He ran from police then shot the taser at police pretty dumb thats why you dont run,6,2020-11-13 10:40:59.345294,85
garypanter1881,Why wasnt he at home taking care of his wife and kids Why was the Wendys burned down People had jobs there and were trying to to pay rent and take care of their kids,1,2020-11-13 10:40:59.345294,170
shane6845,Play the full footage,0,2020-11-13 10:40:59.345294,22
ivankaspeadsforquincyjones9273,Dude was sleeping in his car Dude stood perfectly upright through the whole interview and tried to be honest and tell them he had one and a half margaritas which is nothing for a man his size If the police are so worried about safety go after the Millions of mindless drivers staring at their stupid phones These cops were hunting Policing is Big Business and they still need our tax money,6,2020-11-13 10:40:59.345294,394
simaoluis9443,Then why resist arrest,0,2020-11-13 10:40:59.345294,23
Cpsteg,Why cant you show the whole video or the other videos You guys show small clip with somebody talkin over it giving you their narrative and trying to tell you how to think and feel about it Heres a link to a video bet shows multiple videos of what happened you can turn off the sound and not listen to The Narrative and still figure out whats going on,0,2020-11-13 10:40:59.345294,356
sori6524,Japan Ill just use a train and come and get the car tomorrow,246,2020-11-13 10:40:59.345294,63
wattsup1004,RB had a choice Get handcuffed and go to jail peacefully or do what he did and die The Cop saw him running RB shoots the stun gun and kept running Who knows he could have then grabbed a piece of wood and knocked one of them cops or anyone else in the head he coud have hyjacked a car he could have used anything around him since he was bent enough to get away that he shot the stun gun Quick Cop verdict Innocent,0,2020-11-13 10:40:59.345294,420
lastsam9846,Not justified to use deadly force,0,2020-11-13 10:40:59.345294,34
andyfam5613,The restaurant had better footage than the body cam I wonder why CNN didnt wanna use that footage Maybe cuz it shows the suspect turning and trying to use the taser on the police,11,2020-11-13 10:40:59.345294,181
ghadi202X,so intoxicated he passed out at the Wendys drive through lol,0,2020-11-13 10:40:59.345294,60
markjacobs3468,He was drinking and driving He resisted arrest and stole a taser and shot it at police This was 100 percent justified They call him a good father but he got charged for cruelty to children He made some stupid decisions that night and it cost him his life,0,2020-11-13 10:40:59.345294,260
trevordidham5245,I wonder which one of their news anchors will cry today,6,2020-11-13 10:40:59.345294,56
deeply4514,What i dont inderstand  taking the taser gun then  running AWAY FROM THEM why shoot him they had his information he didnt take it then turn to use it on them instead runs away,0,2020-11-13 10:40:59.345294,175
andym8533,So lets all just ignore the video footage of Rayshard running off with the taser and pointing it a the police That is why he got shot,11,2020-11-13 10:40:59.345294,135
mitchc5538,Im sorry but why is the media giving this so much coverage George Floyds case was special in that it was so clearly wrong This case on the other hand is not clear He shouldnt have run He shouldnt have pointed the taser When cases like this get so much attention it starts to shed negative light on the larger movement,0,2020-11-13 10:40:59.345294,327
zeusincoming282,But I have to agree the shooting was a bit much he was wanted for DUI not Murger or Rape,0,2020-11-13 10:40:59.345294,93
BroTalk1000,cops love losing their jobssmh,7,2020-11-13 10:40:59.345294,32
blackdollars718,Can somebody explain how 2cops cant contain a drunk man on the floor ill wait,0,2020-11-13 10:40:59.345294,80
terrisantiago9128,Well what did he run for,0,2023-10-14 10:40:59.345294,26
nonombrenoapellido6960,Thanks CNN for editing out when the guy fires at the cop with the Taser as he flees and THEN is shot Dont be fooled people,19,2020-11-13 10:40:59.345294,129
realreal8031,My thing is this  why they shoot to kill  Why not shoot legs if its necessary to shoot  Why kill,0,2020-11-13 10:40:59.345294,101
garywhitehead6211,Theres only 1 problem here CNN reports,1,2020-11-13 10:40:59.345294,47
motzrellagoncha1782,He stole the freakin taser,6,2020-11-13 10:40:59.345294,27
bryanjensen5357,Reparations should be paid out of the police retirement fund,0,2020-11-13 10:40:59.345294,60
kemetTamerikaans1621,Could have just let the guy call someone to pick him up r tell him to uber,1,2020-11-13 10:40:59.345294,74
pjdurkin8582,This guy should not be dead,5,2020-11-13 10:40:59.345294,27
stephaniedorene,"Here is the whole police body camplease watch
httpsyoutubeDhdpG2XzRXQ

 Hes clearly intoxicated and confusedthe first officer was right to call for the DUI test If he drove off and killed someone then what They were very respectful and did their job Mr Brooks even said it was ok the officer was doing his job Why did he resist arrest punch wrestle take his weapon run and shoot the tazer at them Thats like 4 felony counts You cannot do that to the police The tazer could have incapacitated both police officers and then he could have taken their guns The tazer is a weapon thats why the police have them Its sad he died but his unfortunate actions caused this",0,2020-11-13 10:40:59.345294,691
bones007able,His fault for resisting but shooting him for it hell they had his car and even some car chases cops will forego if there is a danger but we cant let a drunk go ,0,2020-11-13 10:40:59.345294,179
New_Beginnings-zu2ns,Im done watching the news,291,2020-11-13 10:40:59.345294,28
draganradulovic8808,Its fear,0,2020-11-13 10:40:59.345294,8
josephhoman6562,First offyou dont resist arrestsecondyou dont take a police officers taser3rd you dont flee from the policeHow can police officers do their job correctly when they are being arrested for doing exactly what they were trained to do,0,2020-11-13 10:40:59.345294,240
eugenes9751,Thats a lot of editing even for CNN,15,2020-11-13 10:40:59.345294,37
mightygod8437,PEOPLE DONT TRUST MEDIA SMFH ,16,2020-11-13 10:40:59.345294,30
craphead9842,shot in the back for a parking fine sue the Bastardsregards Tony,0,2020-11-13 10:40:59.345294,70
mandymoore5774,Why is the camera looking up at the sky towards the end Cop take it off,0,2020-11-13 10:40:59.345294,75
betty7522,If he was drinking and driving he could have killed someonewhy dont they talk about that,0,2020-11-13 10:40:59.345294,93
rayalvarez7247,Too many overweight triggerhappy people in law enforcement,69,2020-11-13 10:40:59.345294,61
pizzaman9170,Nah I got 4 kids Black white red green or blue Im going home tonight to my family and so would all of you keep it at  Joker should of complied with the officer on this one This is way different then Mr Floyd This had nothing to do with racism Everything was going smooth until someone started acting like a ass,0,2020-11-13 10:40:59.345294,327
michaelireland9592,STOP THE MANIPULATION FFS,9,2020-11-13 10:40:59.345294,26
MisterGuitarItalia,I hear THREE shots three for an unarmed suspect,0,2020-11-13 10:40:59.345294,53
landengraham4699,Uhmmm show the dash cam video of the  car where it shows the entire thing  way to show a body cam perspective that fell off,0,2020-11-13 10:40:59.345294,127
TankNSSpank,cnn never tells the whole story,26,2020-11-13 10:40:59.345294,32
michaeltryon673,This time they had every right to You run you could get shot Its the law,0,2020-11-13 10:40:59.345294,76
PianistSk8er,Maybe he resisted arrest because he was afraid the cops would kill him,0,2020-11-13 10:40:59.345294,71
lynxjackson2779,I cant believe this is getting so much attention he stole an officers taser and tried to shoot him with it some kills are good,8,2020-11-13 10:40:59.345294,127
adamtel3521,The police did what was right there is no debate in this,0,2020-11-13 10:40:59.345294,57
reginalddavis1619,There was no need for him to run He wouldve been home with his family maybe with a DUI and his life,0,2020-11-13 10:40:59.345294,101
rydah1240,He Was RESISTING BIG TIME None of this would of happened  if only he cooperated and STAYED DOWN after getting tasered Sad As it sounds its the guys fault But Im sure you guys are still going to push the agenda,5,2020-11-13 10:40:59.345294,214
taximan7912,In the first place the police not supposed arresting him he is on private property hes not on the main road,0,2020-11-13 10:40:59.345294,108
abrahamramirez7239,Its on 11Alive check it out full uncut footage,0,2020-11-13 10:40:59.345294,47
cynicaltimber3455,Waste of 248 seconds,8,2020-11-13 10:40:59.345294,22
trippasnippa119,a few weeks ago the judge who convicted the cop who shot rayshad and the other cop charged 2 cops for aggravated assault on college students with a taser aggravated assault suggests that the weapon they were using was in fact a deadly weapon If he thinks a taser is a deadly weapon in that situation then why isnt it a deadly weapon in this situation BECAUSE OF DOUBLE STANDARDS,0,2020-11-13 10:40:59.345294,383
ivydoo1886,What they dont show u is him taking there tazer and aiming at the officer but ok,0,2020-11-13 10:40:59.345294,80
lustxglory,damn cnn show the real angle,16,2020-11-13 10:40:59.345294,29
tjbeatz,Whoever called the cops talking bout son sleeping needs to get klap,0,2020-11-13 10:40:59.345294,67
mohamedmoustaphadiallo872,Rashard had no malice,0,2020-11-13 10:40:59.345294,21
Kionnaallure,Im about tired of yall defending the police and acting like you really believe they are scared for their lives Lets remember that hundreds of professionals have to deal with crazy and sometimes violent persons daily Could you imagine a nurse unloading a magazine on a patient who wouldnt lay down Seems extreme doesnt it The same goes for mental health counselors therapist and FBI agents,6,2020-11-13 10:40:59.345294,398
Sho-np2qz,Hes trying to fire the taser at the police,10,2020-11-13 10:40:59.345294,43
1Kratos69,Dood was drunk ass hell Ive seen whole video hell he didnt even know where he was,0,2020-11-13 10:40:59.345294,83
shaec9397,He shot at the cop with the taser,0,2020-11-13 10:40:59.345294,33
JohnLee-kl4tc,How about shutting up and just showing the full video This kind of deception should be illegal,6,2020-11-13 10:40:59.345294,95
MrKongatthegates,Yeah but with adrenaline shit happens,0,2020-11-13 10:40:59.345294,37
